{
    "encoding" : "UTF-8",
    "schema"   : "2.0",
    "version"  : "2020-09-15T17:00.Bad",
    "description"   : "Defective test schedule 2: Sunday starts at 06:00.",
    "library"       : "../test/Music",
    "playlists"     : "../test/Playlists",
    "announcements" : "..",

    "sources" :
    {
        "master" : {"medium" : "playlist", "encoding" : "mixed", 
                    "location": "master.m3u", "repeat" : true,
                    "duration" : 38253.2 }
    },

    "dayprograms" : {

        "sunday" : [
            {"start" : "06:00", "program" : "OFF" },
            {"start" : "07:30", "program" : "master" },
            {"start" : "21:00", "program" : "OFF" }
        ],
        "monday" : [
            {"start" : "00:00", "program" : "OFF" },
            {"start" : "07:30", "program" : "master" },
            {"start" : "21:00", "program" : "OFF" }
        ],
        "tuesday" : [
            {"start" : "00:00", "program" : "OFF" },
            {"start" : "07:30", "program" : "master" },
            {"start" : "21:00", "program" : "OFF" }
        ],
        "wednesday" : [
            {"start" : "00:00", "program" : "OFF" },
            {"start" : "07:30", "program" : "master" },
            {"start" : "21:00", "program" : "OFF" }
        ],
        "thursday" : [
            {"start" : "00:00", "program" : "OFF" },
            {"start" : "07:30", "program" : "master" },
            {"start" : "21:00", "program" : "OFF" }
        ],
        "friday" : [
            {"start" : "00:00", "program" : "OFF" },
            {"start" : "07:30", "program" : "master" },
            {"start" : "21:00", "program" : "OFF" }
        ],
        "saturday" : [
            {"start" : "00:00", "program" : "OFF" },
            {"start" : "07:30", "program" : "master" },
            {"start" : "21:00", "program" : "OFF" }
        ]
    }
}
